# 三次握手 SYN=1 Seq=0
23	0.998478877	127.0.0.1	127.0.0.1	TCP	74	54866 → 12345 [SYN] Seq=0 Win=65495 Len=0 MSS=65495 SACK_PERM TSval=2739760447 TSecr=0 WS=128
# 三次握手 SYN=1 Ack=1 Seq=0
24	0.998513909	127.0.0.1	127.0.0.1	TCP	74	12345 → 54866 [SYN, ACK] Seq=0 Ack=1 Win=65483 Len=0 MSS=65495 SACK_PERM TSval=2739760447 TSecr=2739760447 WS=128
# 三次握手 ACK=1 Ack=1 Seq=1 
25	0.998549093	127.0.0.1	127.0.0.1	TCP	66	54866 → 12345 [ACK] Seq=1 Ack=1 Win=65536 Len=0 TSval=2739760447 TSecr=2739760447
# TLS
26	1.136709883	127.0.0.1	127.0.0.1	TLSv1.3	506	Client Hello
27	1.136764581	127.0.0.1	127.0.0.1	TCP	66	12345 → 54866 [ACK] Seq=1 Ack=441 Win=65152 Len=0 TSval=2739760585 TSecr=2739760585
28	1.187220730	127.0.0.1	127.0.0.1	TLSv1.3	193	Server Hello
29	1.187275289	127.0.0.1	127.0.0.1	TCP	66	54866 → 12345 [ACK] Seq=441 Ack=128 Win=65536 Len=0 TSval=2739760635 TSecr=2739760635
30	1.205039094	127.0.0.1	127.0.0.1	TLSv1.3	72	Change Cipher Spec
31	1.205069491	127.0.0.1	127.0.0.1	TCP	66	54866 → 12345 [ACK] Seq=441 Ack=134 Win=65536 Len=0 TSval=2739760653 TSecr=2739760653
32	1.208757538	127.0.0.1	127.0.0.1	TLSv1.3	136	Application Data
33	1.208787365	127.0.0.1	127.0.0.1	TCP	66	54866 → 12345 [ACK] Seq=441 Ack=204 Win=65536 Len=0 TSval=2739760657 TSecr=2739760657
34	1.217810135	127.0.0.1	127.0.0.1	TLSv1.3	72	Change Cipher Spec
35	1.217841719	127.0.0.1	127.0.0.1	TCP	66	12345 → 54866 [ACK] Seq=204 Ack=447 Win=65536 Len=0 TSval=2739760666 TSecr=2739760666
36	1.246309766	127.0.0.1	127.0.0.1	TLSv1.3	1024	Application Data
37	1.286455135	127.0.0.1	127.0.0.1	TCP	66	54866 → 12345 [ACK] Seq=447 Ack=1162 Win=65536 Len=0 TSval=2739760735 TSecr=2739760695
38	1.307879873	127.0.0.1	127.0.0.1	TLSv1.3	368	Application Data
39	1.307925658	127.0.0.1	127.0.0.1	TCP	66	54866 → 12345 [ACK] Seq=447 Ack=1464 Win=65280 Len=0 TSval=2739760756 TSecr=2739760756
40	1.318200577	127.0.0.1	127.0.0.1	TLSv1.3	156	Application Data
41	1.318245643	127.0.0.1	127.0.0.1	TCP	66	54866 → 12345 [ACK] Seq=447 Ack=1554 Win=65280 Len=0 TSval=2739760766 TSecr=2739760766
42	1.335140455	127.0.0.1	127.0.0.1	TLSv1.3	156	Application Data
43	1.346419376	127.0.0.1	127.0.0.1	TLSv1.3	1288	Application Data
44	1.346489985	127.0.0.1	127.0.0.1	TLSv1.3	119	Application Data
45	1.347276147	127.0.0.1	127.0.0.1	TLSv1.3	136	Application Data
46	1.353047826	127.0.0.1	127.0.0.1	TLSv1.3	106	Application Data
47	1.353247409	127.0.0.1	127.0.0.1	TLSv1.3	106	Application Data
48	1.355135373	127.0.0.1	127.0.0.1	TCP	66	12345 → 54866 [ACK] Seq=2846 Ack=671 Win=65536 Len=0 TSval=2739760803 TSecr=2739760801
49	1.357278754	127.0.0.1	127.0.0.1	TLSv1.3	106	Application Data
50	1.357309272	127.0.0.1	127.0.0.1	TCP	54	54866 → 12345 [RST] Seq=671 Win=0 Len=0

51	1.522626377	127.0.0.1	127.0.0.1	TCP	74	36316 → 41307 [SYN] Seq=0 Win=65495 Len=0 MSS=65495 SACK_PERM TSval=2739760971 TSecr=0 WS=128
52	1.522660340	127.0.0.1	127.0.0.1	TCP	74	41307 → 36316 [SYN, ACK] Seq=0 Ack=1 Win=65483 Len=0 MSS=65495 SACK_PERM TSval=2739760971 TSecr=2739760971 WS=128
53	1.522694488	127.0.0.1	127.0.0.1	TCP	66	36316 → 41307 [ACK] Seq=1 Ack=1 Win=65536 Len=0 TSval=2739760971 TSecr=2739760971
54	1.690164141	127.0.0.1	127.0.0.1	TCP	66	43780 → 40561 [FIN, ACK] Seq=1 Ack=1 Win=65536 Len=0 TSval=2739761138 TSecr=2739760195
55	1.692496040	127.0.0.1	127.0.0.1	TCP	66	40561 → 43780 [FIN, ACK] Seq=1 Ack=2 Win=65536 Len=0 TSval=2739761141 TSecr=2739761138
56	1.692538332	127.0.0.1	127.0.0.1	TCP	66	43780 → 40561 [ACK] Seq=2 Ack=2 Win=65536 Len=0 TSval=2739761141 TSecr=2739761141
57	1.697374992	127.0.0.1	127.0.0.1	TCP	66	35414 → 45051 [FIN, ACK] Seq=1 Ack=1 Win=512 Len=0 TSval=2739761146 TSecr=2739738346
58	1.698540894	127.0.0.1	127.0.0.1	TCP	66	45051 → 35414 [ACK] Seq=1 Ack=2 Win=512 Len=0 TSval=2739761147 TSecr=2739761146
59	1.698792116	127.0.0.1	127.0.0.1	TCP	66	45051 → 35414 [FIN, ACK] Seq=1 Ack=2 Win=512 Len=0 TSval=2739761147 TSecr=2739761146
60	1.698818819	127.0.0.1	127.0.0.1	TCP	66	35414 → 45051 [ACK] Seq=2 Ack=2 Win=512 Len=0 TSval=2739761147 TSecr=2739761147
61	2.452107986	127.0.0.1	127.0.0.1	TCP	97	36316 → 41307 [PSH, ACK] Seq=1 Ack=1 Win=65536 Len=31 TSval=2739761900 TSecr=2739760971
62	2.452150214	127.0.0.1	127.0.0.1	TCP	66	41307 → 36316 [ACK] Seq=1 Ack=32 Win=65536 Len=0 TSval=2739761900 TSecr=2739761900
